<?xml version="1.0" encoding="utf-8" standalone="yes"?>
<!--Erzeugt mit KIT (www.kit.edu) GML-Toolbox, Erstellungsdatum: 02/01/19-->
<Nutzungsprofile xmlns:xsi="http://www.w3.org/2001/XMLSchema-instance" xsi:noNamespaceSchemaLocation="XSD/Nutzungsprofile.xsd">
 

<!--====================================================================================================-->
<!--                ASHRAE Profile                                                                      -->
<!--====================================================================================================--> 
 <NutzungsprofilGeraete>
    <name>ASHRAE-140-600-Geraete</name>
    <aktiv>true</aktiv>
   <periode startDay="1" startMonth="1" endDay="31" endMonth="12">
    <zeitreihe minValue="0" maxValue="1" defaultValue="0.5">
     <day>typicalDay</day>
     <uom>scale</uom>
     <values>1. 1. 1. 1. 1. 1. 1. 1. 1. 1. 1. 1. 1. 1. 1. 1. 1. 1. 1. 1. 1. 1. 1. 1.</values>
    </zeitreihe>
   </periode>    
    <konvektAnteil>40</konvektAnteil>
    <maxWaermeleistung>4.166667</maxWaermeleistung>
  </NutzungsprofilGeraete>
 
  <NutzungsprofilHeizung>
    <name>ASHRAE-140-600-Heizung</name>
    <aktiv>true</aktiv>
   <periode startDay="1" startMonth="1" endDay="31" endMonth="12">
    <zeitreihe minValue="5" maxValue="25" defaultValue="20">
     <day>typicalDay</day>
     <uom>C</uom>
     <values>20. 20. 20. 20. 20. 20. 20. 20. 20. 20. 20. 20. 20. 20. 20. 20. 20. 20. 20. 20. 20. 20. 20. 20.</values>
    </zeitreihe>
  </periode>    
  </NutzungsprofilHeizung>
 
  <NutzungsprofilLueftung>
    <name>ASHRAE-140-600-Lueftung</name>
    <aktiv>true</aktiv>
   <periode startDay="1" startMonth="1" endDay="31" endMonth="12">
    <zeitreihe minValue="0" maxValue="15" defaultValue="0.5">
      <day>typicalDay</day>
      <uom>1/h</uom>
      <values>0.5 0.5 0.5 0.5 0.5 0.5 0.5 0.5 0.5 0.5 0.5 0.5 0.5 0.5 0.5 0.5 0.5 0.5 0.5 0.5 0.5 0.5 0.5 0.5</values>
    </zeitreihe>
   </periode>
  </NutzungsprofilLueftung>
 
  <NutzungsprofilKuehlung>
    <name>ASHRAE-140-600-Kuehlung</name>
    <aktiv>true</aktiv>
   <periode startDay="1" startMonth="1" endDay="31" endMonth="12">
    <zeitreihe minValue="5" maxValue="35" defaultValue="27">
      <day>typicalDay</day>
      <uom>C</uom>
      <values>27. 27. 27. 27. 27. 27. 27. 27. 27. 27. 27. 27. 27. 27. 27. 27. 27. 27. 27. 27. 27. 27. 27. 27.</values>
    </zeitreihe>
   </periode>
  </NutzungsprofilKuehlung>
 
 <NutzungsprofilBeleuchtung>
  <name>KeineBeleuchtung</name>
  <aktiv>false</aktiv>
  <periode startDay="1" startMonth="1" endDay="31" endMonth="12">
   <zeitreihe minValue="0" maxValue="1" defaultValue="0.5">
    <day>typicalDay</day>
    <uom>scale</uom>
    <values>0. 0. 0. 0. 0. 0. 0. 0. 0. 0. 0. 0. 0. 0. 0. 0. 0. 0. 0. 0. 0. 0. 0. 0.</values>
   </zeitreihe>
  </periode>
  <automatisch>false</automatisch>
  <konvektAnteil>50</konvektAnteil>
  <maxHelligkeit>200</maxHelligkeit>
  <effizienz>50</effizienz>
  <maxWaermeleistung>4</maxWaermeleistung>
 </NutzungsprofilBeleuchtung>
 
 <NutzungsprofilPersonen>
  <name>KeinePersonen</name>
  <aktiv>false</aktiv>
  <periode startDay="1" startMonth="1" endDay="31" endMonth="12">
   <zeitreihe minValue="0" maxValue="1" defaultValue="0.5">
    <day>typicalDay</day>
    <uom>scale</uom>
    <values>0. 0. 0. 0. 0. 0. 0. 0. 0. 0. 0. 0. 0. 0. 0. 0. 0. 0. 0. 0. 0. 0. 0. 0.</values>
   </zeitreihe>
  </periode>
  <waermeleistungPerson>0</waermeleistungPerson>
  <konvektAnteil>50</konvektAnteil>
  <flaecheProPerson>INF</flaecheProPerson>
 </NutzungsprofilPersonen>
 
 <NutzungsprofilBetrieb>
  <name>On-7h-18h</name>
  <periode startDay="1" startMonth="1" endDay="31" endMonth="12">
   <zeitreihe minValue="0" maxValue="1" defaultValue="0">
    <day>typicalDay</day>
    <uom>-</uom>
    <values>0 0 0 0 0 0 0 1 1 1 1 1 1 1 1 1 1 1 0 0 0 0 0 0</values>
   </zeitreihe>
  </periode>
  <system>cooling</system>
 </NutzungsprofilBetrieb>
 
 <NutzungsprofilLueftung>
  <name>ASHRAE-140-650-Lueftung</name>
  <aktiv>true</aktiv>
  <periode startDay="1" startMonth="1" endDay="31" endMonth="12">
   <zeitreihe minValue="0" maxValue="15" defaultValue="0.5">
    <day>typicalDay</day>
    <uom>1/h</uom>
    <values>13.142 13.142 13.142 13.142 13.142 13.142 13.142 0 0 0 0 0 0 0 0 0 0 0 13.142 13.142 13.142 13.142 13.142 13.142</values>
   </zeitreihe>
  </periode>
 </NutzungsprofilLueftung>
 
 <!--====================================================================================================-->
 <!--                Profile Bau 445                                                                     -->
 <!--====================================================================================================--> 
  <NutzungsprofilBeleuchtung>
    <name>Bau-445-Beleuchtung</name>
    <aktiv>true</aktiv>
   <periode startDay="1" startMonth="1" endDay="31" endMonth="12">
    <zeitreihe minValue="0" maxValue="1" defaultValue="0.5">
      <day>weekDay</day>
      <uom>scale</uom>
      <values>0. 0. 0. 0. 0. 0. 0. 1. 1. 1. 1. 1. 1. 1. 1. 1. 1. 1. 0. 0. 0. 0. 0. 0.</values>
    </zeitreihe>
    <zeitreihe minValue="0" maxValue="1" defaultValue="0.5">
      <day>weekEnd</day>
      <uom>scale</uom>
      <values>0. 0. 0. 0. 0. 0. 0. 0. 0. 0. 0. 0. 0. 0. 0. 0. 0. 0. 0. 0. 0. 0. 0. 0.</values>
    </zeitreihe>
   </periode>
    <automatisch>false</automatisch>
    <konvektAnteil>50</konvektAnteil>
    <maxHelligkeit>200</maxHelligkeit>
    <effizienz>50</effizienz>
    <maxWaermeleistung>4</maxWaermeleistung>
  </NutzungsprofilBeleuchtung>
 
  <NutzungsprofilGeraete>
    <name>Bau-445-Geräte</name>
    <aktiv>true</aktiv>
   <periode startDay="1" startMonth="1" endDay="31" endMonth="12">
    <zeitreihe minValue="0" maxValue="1" defaultValue="0.5">
      <day>weekDay</day>
      <uom>scale</uom>
      <values>0.1 0.1 0.1 0.1 0.1 0.1 0.1 0.2 0.4 0.8 0.8 0.4 0.2 0.4 0.8 0.8 0.2 0.1 0.1 0.1 0.1 0.1 0.1 0.1</values>
    </zeitreihe>
    <zeitreihe minValue="0" maxValue="1" defaultValue="0.5">
      <day>weekEnd</day>
      <uom>scale</uom>
      <values>0. 0. 0. 0. 0. 0. 0. 0. 0. 0. 0. 0. 0. 0. 0. 0. 0. 0. 0. 0. 0. 0. 0. 0.</values>
    </zeitreihe>
   </periode>
    <konvektAnteil>50</konvektAnteil>
    <maxWaermeleistung>5</maxWaermeleistung>
  </NutzungsprofilGeraete>
 
  <NutzungsprofilHeizung>
    <name>Bau-445-Heizung</name>
    <description>Konstante Tageswerte ohne Nachtabsenkung</description>
    <aktiv>true</aktiv>
   <periode startDay="1" startMonth="1" endDay="31" endMonth="12">
    <zeitreihe minValue="17" maxValue="23" defaultValue="21">
      <day>weekDay</day>
      <uom>C</uom>
      <values>21. 21. 21. 21. 21. 21. 21. 21. 21. 21. 21. 21. 21. 21. 21. 21. 21. 21. 21. 21. 21. 21. 21. 21.</values>
    </zeitreihe>
    <zeitreihe minValue="17" maxValue="22" defaultValue="18">
      <day>weekEnd</day>
      <uom>C</uom>
      <values>21. 21. 21. 21. 21. 21. 21. 21. 21. 21. 21. 21. 21. 21. 21. 21. 21. 21. 21. 21. 21. 21. 21. 21.</values>
    </zeitreihe>
   </periode>
  </NutzungsprofilHeizung>
 
  <NutzungsprofilKuehlung>
    <name>Bau-445-Kuehlung</name>
    <description>Keine Kühlung</description>
    <aktiv>false</aktiv>
   <periode startDay="1" startMonth="1" endDay="31" endMonth="12">
    <zeitreihe minValue="15" maxValue="30" defaultValue="25">
      <day>typicalDay</day>
      <uom>C</uom>
      <values>25. 25. 25. 25. 25. 25. 25. 25. 25. 25. 25. 25. 25. 25. 25. 25. 25. 25. 25. 25. 25. 25. 25. 25.</values>
    </zeitreihe>
   </periode>
  </NutzungsprofilKuehlung>
 
  <NutzungsprofilLueftung>
    <name>Bau-445-Lüftung</name>
    <aktiv>true</aktiv>
   <periode startDay="1" startMonth="1" endDay="31" endMonth="12">
    <zeitreihe minValue="0" maxValue="2" defaultValue="0.5">
      <day>weekDay</day>
      <uom>1/h</uom>
      <values>0. 0. 0. 0. 0. 0. 0. 1.2 1.2 1.2 1.2 1.2 1.2 1.2 1.2 1.2 1.2 1.2 1.2 1.2 1.2 1.2 0. 0.</values>
    </zeitreihe>
    <zeitreihe minValue="0" maxValue="2" defaultValue="0.5">
      <day>weekEnd</day>
      <uom>1/h</uom>
      <values>0. 0. 0. 0. 0. 0. 0. 0. 0. 0. 0. 0. 0. 0. 0. 0. 0. 0. 0. 0. 0. 0. 0. 0.</values>
    </zeitreihe>
   </periode>
  </NutzungsprofilLueftung>
 
  <NutzungsprofilPersonen>
    <name>Bau-445-Personen</name>
    <description>Maximale Anwesenheit zwischen 8h und 18h</description>
    <aktiv>true</aktiv>
   <periode startDay="1" startMonth="1" endDay="31" endMonth="12">
    <zeitreihe minValue="0" maxValue="1" defaultValue="0.5">
      <day>weekDay</day>
      <uom>scale</uom>
      <values>0. 0. 0. 0. 0. 0. 0. 0.2 0.4 0.6 0.8 0.8 0.4 0.6 0.8 0.8 0.4 0.2 0. 0. 0. 0. 0. 0.</values>
    </zeitreihe>
    <zeitreihe minValue="0" maxValue="1" defaultValue="0.5">
      <day>weekEnd</day>
      <uom>scale</uom>
      <values>0. 0. 0. 0. 0. 0. 0. 0. 0. 0. 0. 0. 0. 0. 0. 0. 0. 0. 0. 0. 0. 0. 0. 0.</values>
    </zeitreihe>
   </periode>
    <waermeleistungPerson>82</waermeleistungPerson>
    <konvektAnteil>50</konvektAnteil>
    <flaecheProPerson>32.851189091868</flaecheProPerson>   
  </NutzungsprofilPersonen>
 
 <!--====================================================================================================-->
 <!--                Profile DIN 18500-10 Gruppenbüro                                                    -->
 <!--====================================================================================================--> 
  <NutzungsprofilBeleuchtung>
    <name>DIN_18599_10_GruppenbüroBeleuchtung</name>
    <aktiv>true</aktiv>
   <periode startDay="1" startMonth="1" endDay="31" endMonth="12">
    <zeitreihe minValue="0" maxValue="1" defaultValue="0.5">
      <day>weekDay</day>
      <uom>scale</uom>
      <values>0. 0. 0. 0. 0. 0. 0. 0.5 0.5 0.5 0.5 0.5 0.5 0.5 0.5 0.5 0.5 0.5 0. 0. 0. 0. 0. 0.</values>